id,title,authors,year,venue_or_status,url,doi,arxiv_id,openalex_id,notes
arxiv-260608388-the-spectral-dynamics-and-noise-geometry,The Spectral Dynamics and Noise Geometry of Muon,Pierfrancesco Beneventano; Mahmoud Abdelmoneum; Tomaso Poggio,2026,arXiv candidate,https://arxiv.org/abs/2606.08388,10.48550/arXiv.2606.08388,2606.08388,,"Phase 2 audit on 2026-06-14: promoted from candidate/excluded because title/abstract evidence is directly about Muon, a Muon variant, or Muon orthogonalization. Evidence level: primary arXiv/web record opened. URL(s): https://arxiv.org/abs/2606.08388"
arxiv-260609658-muon-learns-more-robust-and-transferable,Muon Learns More Robust and Transferable Features than Adam,Tianyu Ruan; Fengzhuo Zhang; Shuche Wang; Shihua Zhang,2026,arXiv candidate,https://arxiv.org/abs/2606.09658,10.48550/arXiv.2606.09658,2606.09658,,"Phase 2 audit on 2026-06-14: promoted from candidate/excluded because title/abstract evidence is directly about Muon, a Muon variant, or Muon orthogonalization. Evidence level: primary arXiv/web record opened. URL(s): https://arxiv.org/abs/2606.09658"
arxiv-251001377-demuon-a-decentralized-muon-for-matrix-o,DeMuon: A Decentralized Muon for Matrix Optimization over Graphs,Chuan He; Shuyi Ren; Jingwei Mao; Erik G. Larsson,2025,arXiv candidate,https://arxiv.org/abs/2510.01377,10.48550/arXiv.2510.01377,2510.01377,,"Phase 2 audit on 2026-06-14: promoted from candidate/excluded because title/abstract evidence is directly about Muon, a Muon variant, or Muon orthogonalization. Evidence level: primary arXiv URL retained from Phase 1 high-recall pool. URL(s): https://arxiv.org/abs/2510.01377"
arxiv-260522432-amuse-anytime-muon-with-stable-gradient-,AMUSE: Anytime Muon with Stable Gradient Evaluation,Jueun Kim; Baekrok Shin; Jihun Yun; Beomhan Baek; Minhak Song; Chulhee Yun,2026,arXiv candidate,https://arxiv.org/abs/2605.22432,10.48550/arXiv.2605.22432,2605.22432,,"Phase 2 audit on 2026-06-14: promoted from candidate/excluded because title/abstract evidence is directly about Muon, a Muon variant, or Muon orthogonalization. Evidence level: primary arXiv/web record opened. URL(s): https://arxiv.org/abs/2605.22432"
kimi2025-k2-muonclip,Kimi K2: Open Agentic Intelligence,Kimi Team,2025,arXiv technical report,https://arxiv.org/abs/2507.20534,10.48550/arXiv.2507.20534,2507.20534,,"Phase 2 web search found the Kimi K2 report; its abstract says the authors propose MuonClip, an improvement over Muon with QK-clip, and train K2 on 15.5T tokens without loss spikes."
wang2026-vescale-fsdp,veScale-FSDP: Flexible and High-Performance FSDP at Scale,Zezou Wang; Youjie Li; Zhiqi Lin; Jiacheng Yang; Cong Xie; Guanyu Feng; Zheng Zhong; Ziyue Huang; Hongyu Zhu; Zhi Zhang; Yanghua Peng; Xin Liu,2026,arXiv,https://arxiv.org/abs/2602.22437,10.48550/arXiv.2602.22437,2602.22437,,Phase 2 web search found the veScale-FSDP report; its abstract explicitly lists Muon as a non-element-wise optimizer that current FSDP systems struggle to support.
